{
  "schemaVersion" : "matching.m14.generated.v1",
  "unit" : "M14",
  "contractPlanVersion" : "0.17",
  "startCommit" : "96b749861292950749701e34a6f20796f239cd4b",
  "workloadSha256" : "005afdabc720ab782ea092e416a7d9c1273daf09246eede1e43607ed110ad9e3",
  "profileSha256" : "02ef0ee44900e1a472fea03ed5cb406215550994826b53f4b708e33815c6be9d",
  "primitiveCountMeaning" : "Concrete workload transition, read, capture, restore, frame and sink steps; oracle evaluation and diagnostic image reads are validation observations.",
  "histories" : [ {
    "primitiveAttempts" : 1274,
    "assertions" : 23943,
    "primitiveKinds" : {
      "GENESIS_IMPORT" : 2,
      "BUSINESS" : 309,
      "RETRY" : 21,
      "CONTROL" : 198,
      "READ" : 340,
      "LOCAL_DURABLE_ACCEPT" : 354,
      "LOCAL_SNAPSHOT_INSTALL" : 10,
      "SNAPSHOT_CAPTURE" : 20,
      "SNAPSHOT_RESTORE" : 20
    },
    "historyId" : 0,
    "status" : "PASS",
    "failure" : "",
    "logicalActions" : 80,
    "preludeBusinessCommands" : 1,
    "actualTradeRecords" : 2,
    "differentMakerTakerAccountAssertions" : 2,
    "rawFile" : "generated-00.jsonl.gz",
    "rawSha256" : "e06a3052b087de3790ab0f07d49a2d9240caed7a59711cc45d36ef748d6eb44f",
    "rawBytes" : 1120887
  }, {
    "primitiveAttempts" : 1186,
    "assertions" : 21298,
    "primitiveKinds" : {
      "GENESIS_IMPORT" : 2,
      "BUSINESS" : 276,
      "RETRY" : 20,
      "CONTROL" : 185,
      "READ" : 330,
      "LOCAL_DURABLE_ACCEPT" : 323,
      "LOCAL_SNAPSHOT_INSTALL" : 10,
      "SNAPSHOT_CAPTURE" : 20,
      "SNAPSHOT_RESTORE" : 20
    },
    "historyId" : 1,
    "status" : "PASS",
    "failure" : "",
    "logicalActions" : 80,
    "preludeBusinessCommands" : 1,
    "actualTradeRecords" : 1,
    "differentMakerTakerAccountAssertions" : 1,
    "rawFile" : "generated-01.jsonl.gz",
    "rawSha256" : "93618bb428690a2884f82ceedb67208a77379b100921e36ef245d269edd2ff86",
    "rawBytes" : 985914
  }, {
    "primitiveAttempts" : 1185,
    "assertions" : 21391,
    "primitiveKinds" : {
      "GENESIS_IMPORT" : 2,
      "BUSINESS" : 276,
      "RETRY" : 20,
      "CONTROL" : 185,
      "READ" : 330,
      "LOCAL_DURABLE_ACCEPT" : 322,
      "LOCAL_SNAPSHOT_INSTALL" : 10,
      "SNAPSHOT_CAPTURE" : 20,
      "SNAPSHOT_RESTORE" : 20
    },
    "historyId" : 2,
    "status" : "PASS",
    "failure" : "",
    "logicalActions" : 80,
    "preludeBusinessCommands" : 1,
    "actualTradeRecords" : 2,
    "differentMakerTakerAccountAssertions" : 2,
    "rawFile" : "generated-02.jsonl.gz",
    "rawSha256" : "b263afb0b0a8ad3208b06e5a5c73b6d34107703cc09410ba0e1834a74b193223",
    "rawBytes" : 992675
  }, {
    "primitiveAttempts" : 1175,
    "assertions" : 21260,
    "primitiveKinds" : {
      "GENESIS_IMPORT" : 2,
      "BUSINESS" : 276,
      "RETRY" : 20,
      "CONTROL" : 181,
      "READ" : 326,
      "LOCAL_DURABLE_ACCEPT" : 320,
      "LOCAL_SNAPSHOT_INSTALL" : 10,
      "SNAPSHOT_CAPTURE" : 20,
      "SNAPSHOT_RESTORE" : 20
    },
    "historyId" : 3,
    "status" : "PASS",
    "failure" : "",
    "logicalActions" : 80,
    "preludeBusinessCommands" : 1,
    "actualTradeRecords" : 1,
    "differentMakerTakerAccountAssertions" : 1,
    "rawFile" : "generated-03.jsonl.gz",
    "rawSha256" : "b6464ed91f92faecb757236c2952a4dd24c914abbf7421a6f894c5e427586fc7",
    "rawBytes" : 977431
  }, {
    "primitiveAttempts" : 1190,
    "assertions" : 21586,
    "primitiveKinds" : {
      "GENESIS_IMPORT" : 2,
      "BUSINESS" : 274,
      "RETRY" : 20,
      "CONTROL" : 189,
      "READ" : 333,
      "LOCAL_DURABLE_ACCEPT" : 322,
      "LOCAL_SNAPSHOT_INSTALL" : 10,
      "SNAPSHOT_CAPTURE" : 20,
      "SNAPSHOT_RESTORE" : 20
    },
    "historyId" : 4,
    "status" : "PASS",
    "failure" : "",
    "logicalActions" : 80,
    "preludeBusinessCommands" : 1,
    "actualTradeRecords" : 1,
    "differentMakerTakerAccountAssertions" : 1,
    "rawFile" : "generated-04.jsonl.gz",
    "rawSha256" : "d26bd3bb590523dc0de2fd15ea52baff0527d8b7e3b042cd7c8a54c238d98be0",
    "rawBytes" : 1009510
  }, {
    "primitiveAttempts" : 1192,
    "assertions" : 21285,
    "primitiveKinds" : {
      "GENESIS_IMPORT" : 2,
      "BUSINESS" : 276,
      "RETRY" : 20,
      "CONTROL" : 187,
      "READ" : 332,
      "LOCAL_DURABLE_ACCEPT" : 325,
      "LOCAL_SNAPSHOT_INSTALL" : 10,
      "SNAPSHOT_CAPTURE" : 20,
      "SNAPSHOT_RESTORE" : 20
    },
    "historyId" : 5,
    "status" : "PASS",
    "failure" : "",
    "logicalActions" : 80,
    "preludeBusinessCommands" : 1,
    "actualTradeRecords" : 1,
    "differentMakerTakerAccountAssertions" : 1,
    "rawFile" : "generated-05.jsonl.gz",
    "rawSha256" : "d73e1b1570026f84a8750d7bd4263b4c88b7b6b07228830816fb1e8dd9e20ad7",
    "rawBytes" : 997340
  }, {
    "primitiveAttempts" : 1190,
    "assertions" : 21328,
    "primitiveKinds" : {
      "GENESIS_IMPORT" : 2,
      "BUSINESS" : 276,
      "RETRY" : 20,
      "CONTROL" : 187,
      "READ" : 332,
      "LOCAL_DURABLE_ACCEPT" : 323,
      "LOCAL_SNAPSHOT_INSTALL" : 10,
      "SNAPSHOT_CAPTURE" : 20,
      "SNAPSHOT_RESTORE" : 20
    },
    "historyId" : 6,
    "status" : "PASS",
    "failure" : "",
    "logicalActions" : 80,
    "preludeBusinessCommands" : 1,
    "actualTradeRecords" : 3,
    "differentMakerTakerAccountAssertions" : 2,
    "rawFile" : "generated-06.jsonl.gz",
    "rawSha256" : "a69309241b74edc7e7f4f718a71fe7c7a0c981a45929d280490ff89cf79fc6b9",
    "rawBytes" : 994476
  }, {
    "primitiveAttempts" : 1196,
    "assertions" : 21407,
    "primitiveKinds" : {
      "GENESIS_IMPORT" : 2,
      "BUSINESS" : 276,
      "RETRY" : 20,
      "CONTROL" : 190,
      "READ" : 335,
      "LOCAL_DURABLE_ACCEPT" : 323,
      "LOCAL_SNAPSHOT_INSTALL" : 10,
      "SNAPSHOT_CAPTURE" : 20,
      "SNAPSHOT_RESTORE" : 20
    },
    "historyId" : 7,
    "status" : "PASS",
    "failure" : "",
    "logicalActions" : 80,
    "preludeBusinessCommands" : 1,
    "actualTradeRecords" : 1,
    "differentMakerTakerAccountAssertions" : 1,
    "rawFile" : "generated-07.jsonl.gz",
    "rawSha256" : "6d64dbda50519de0e64c353708e05f66fec5aef8760227a8d3d884811c57051e",
    "rawBytes" : 1051270
  }, {
    "primitiveAttempts" : 1273,
    "assertions" : 23781,
    "primitiveKinds" : {
      "GENESIS_IMPORT" : 2,
      "BUSINESS" : 309,
      "RETRY" : 21,
      "CONTROL" : 199,
      "READ" : 341,
      "LOCAL_DURABLE_ACCEPT" : 351,
      "LOCAL_SNAPSHOT_INSTALL" : 10,
      "SNAPSHOT_CAPTURE" : 20,
      "SNAPSHOT_RESTORE" : 20
    },
    "historyId" : 8,
    "status" : "PASS",
    "failure" : "",
    "logicalActions" : 80,
    "preludeBusinessCommands" : 1,
    "actualTradeRecords" : 1,
    "differentMakerTakerAccountAssertions" : 1,
    "rawFile" : "generated-08.jsonl.gz",
    "rawSha256" : "94580ae6b5a5abcf4b4d92ccdf63befd9ff613b41a5ae33cb8a18cbeae36b36f",
    "rawBytes" : 1087244
  }, {
    "primitiveAttempts" : 1176,
    "assertions" : 21263,
    "primitiveKinds" : {
      "GENESIS_IMPORT" : 2,
      "BUSINESS" : 276,
      "RETRY" : 20,
      "CONTROL" : 181,
      "READ" : 326,
      "LOCAL_DURABLE_ACCEPT" : 321,
      "LOCAL_SNAPSHOT_INSTALL" : 10,
      "SNAPSHOT_CAPTURE" : 20,
      "SNAPSHOT_RESTORE" : 20
    },
    "historyId" : 9,
    "status" : "PASS",
    "failure" : "",
    "logicalActions" : 80,
    "preludeBusinessCommands" : 1,
    "actualTradeRecords" : 3,
    "differentMakerTakerAccountAssertions" : 3,
    "rawFile" : "generated-09.jsonl.gz",
    "rawSha256" : "76b894d83eb6999d398cfecd29a81c3e0ddb283d6a4d645e45726600b2b28b0b",
    "rawBytes" : 950031
  }, {
    "primitiveAttempts" : 1191,
    "assertions" : 21409,
    "primitiveKinds" : {
      "GENESIS_IMPORT" : 2,
      "BUSINESS" : 276,
      "RETRY" : 20,
      "CONTROL" : 187,
      "READ" : 332,
      "LOCAL_DURABLE_ACCEPT" : 324,
      "LOCAL_SNAPSHOT_INSTALL" : 10,
      "SNAPSHOT_CAPTURE" : 20,
      "SNAPSHOT_RESTORE" : 20
    },
    "historyId" : 10,
    "status" : "PASS",
    "failure" : "",
    "logicalActions" : 80,
    "preludeBusinessCommands" : 1,
    "actualTradeRecords" : 3,
    "differentMakerTakerAccountAssertions" : 3,
    "rawFile" : "generated-10.jsonl.gz",
    "rawSha256" : "35d8c5b06b8641cbfd2e075cf7ca1522872b382d0d1787f0573e8637ffa733c5",
    "rawBytes" : 975754
  }, {
    "primitiveAttempts" : 1199,
    "assertions" : 21537,
    "primitiveKinds" : {
      "GENESIS_IMPORT" : 2,
      "BUSINESS" : 276,
      "RETRY" : 20,
      "CONTROL" : 191,
      "READ" : 336,
      "LOCAL_DURABLE_ACCEPT" : 324,
      "LOCAL_SNAPSHOT_INSTALL" : 10,
      "SNAPSHOT_CAPTURE" : 20,
      "SNAPSHOT_RESTORE" : 20
    },
    "historyId" : 11,
    "status" : "PASS",
    "failure" : "",
    "logicalActions" : 80,
    "preludeBusinessCommands" : 1,
    "actualTradeRecords" : 3,
    "differentMakerTakerAccountAssertions" : 3,
    "rawFile" : "generated-11.jsonl.gz",
    "rawSha256" : "c9462ee5758df1d100a0683404acb60511bb6aaf35c71b061c26ec7b0dfc0e59",
    "rawBytes" : 967212
  }, {
    "primitiveAttempts" : 1186,
    "assertions" : 21482,
    "primitiveKinds" : {
      "GENESIS_IMPORT" : 2,
      "BUSINESS" : 274,
      "RETRY" : 20,
      "CONTROL" : 188,
      "READ" : 332,
      "LOCAL_DURABLE_ACCEPT" : 320,
      "LOCAL_SNAPSHOT_INSTALL" : 10,
      "SNAPSHOT_CAPTURE" : 20,
      "SNAPSHOT_RESTORE" : 20
    },
    "historyId" : 12,
    "status" : "PASS",
    "failure" : "",
    "logicalActions" : 80,
    "preludeBusinessCommands" : 1,
    "actualTradeRecords" : 1,
    "differentMakerTakerAccountAssertions" : 1,
    "rawFile" : "generated-12.jsonl.gz",
    "rawSha256" : "fc7e79a0fcae5b3321c9f346554700f1a032c502ea91a84883569c263a9f182c",
    "rawBytes" : 969628
  }, {
    "primitiveAttempts" : 1186,
    "assertions" : 21331,
    "primitiveKinds" : {
      "GENESIS_IMPORT" : 2,
      "BUSINESS" : 276,
      "RETRY" : 20,
      "CONTROL" : 185,
      "READ" : 330,
      "LOCAL_DURABLE_ACCEPT" : 323,
      "LOCAL_SNAPSHOT_INSTALL" : 10,
      "SNAPSHOT_CAPTURE" : 20,
      "SNAPSHOT_RESTORE" : 20